{
  "schema": "letter/1",
  "id": "act1.sprocket_row.night_clerks",
  "act": 1,
  "location": "sprocket_row",
  "reveal_layer": 1,
  "requires": {
    "act1.progress": ">=5",
    "needle.arrears": ">=1",
    "item.rustmoor.rustmoor_ration": ">=5"
  },
  "nerve": 1,
  "sender": "Pip Tumbler",
  "weight": 2,
  "description": "Pip has written on the back of a Counting-House circular. \"The Counting-House night clerks eat out of a drawer, and the drawer is empty. The House buys Rations for them at its own price, and it will set that against your name in the House's books instead of paying you, which is how the House likes to pay anybody. Five would do. Ten would do better. Pip.\"",
  "options": [
    {
      "label": "Send five Rustmoor Rations to the night clerks, against your account.",
      "success": {
        "text": "The Rations go off in a canister marked FRAGILE, which they are not. The receipt comes back on Counting-House paper, entered and initialled. The Arrears dial under your portrait drops a mark. Somewhere at the Brass Exchange, a clerk is eating your stew.",
        "changes": {
          "item.rustmoor.rustmoor_ration": "-5",
          "needle.arrears": "-1"
        }
      }
    },
    {
      "label": "Send ten, and ask Pip to tell the clerks who cooked them.",
      "requires": { "item.rustmoor.rustmoor_ration": ">=10" },
      "success": {
        "text": "Ten Rations take two canisters and most of your shelf. The receipt that comes back is entered, initialled and, unusually, signed. Pip's note on the back says the clerk with your file asked for the recipe. The Arrears dial drops two marks.",
        "changes": {
          "item.rustmoor.rustmoor_ration": "-10",
          "needle.arrears": "-2"
        }
      }
    }
  ]
}
