{
 "schema": "letter/1",
 "id": "act1.fixture_yard.knockabout",
 "revision": 1,
 "act": 1,
 "location": "fixture_yard",
 "reveal_layer": 1,
 "requires": {},
 "nerve": 1,
 "description": "You stand in a fixture yard.",
 "options": [
  {
   "label": "Reply",
   "success": {
    "text": "A knockabout day at the yard.",
    "changes": {
     "flag.fixture_seen": 1
    }
   }
  }
 ],
 "sender": "A fixture neighbour",
 "weight": 1
}
