{
 "schema": "letter/1",
 "id": "act1.fixture_yard.refusal",
 "revision": 1,
 "act": 1,
 "location": "fixture_yard",
 "reveal_layer": 0,
 "requires": {},
 "nerve": 1,
 "description": "You stand in a fixture yard.",
 "options": [
  {
   "label": "Accept",
   "success": {
    "text": "You accept.",
    "changes": {
     "lore.fixture_notes": "+1"
    }
   }
  },
  {
   "label": "Decline",
   "success": {
    "text": "Noted.",
    "changes": {}
   }
  }
 ],
 "sender": "A fixture neighbour",
 "weight": 1
}
